263,leanplum,Leanplum is a mobile marketing platform that delivers meaningful engagement across messaging and the in-app experience.,"A/B Testing, Analytics, App Marketing, Apps, Artificial Intelligence, CRM, Digital Marketing, E-Commerce, E-Commerce Platforms, Email, Email Marketing, Enterprise Software, Intelligent Systems, Machine Learning, Marketing, Marketing Automation, Messaging, Mobile, Mobile Apps",27.5,10,300.4,0.204782882
264,picovico,"Picovico does automatic transformation of your photos, text, video clips into engaging birthday movies.","Photography, Presentations, Software, Video",1.0,9,30.8,0.13571006900000002
265,linchpin,"Linchpin offers sales automation solutions to help IT companies gain and retain customers, and obtain market leadership.","Advertising, Automotive, CRM, Email Marketing, Lead Generation",2.0,10,284.7,0.195065665
266,peer5,Peer5 operates the world__ largest peer-to-peer (p2p) content delivery network.,"SaaS, Video, Video Streaming",15.0,10,3136.5,0.7477039209999999
267,blackjet,BlackJet allows consumers to book seats on private jets immediately and with guaranteed seat availability.,"Consumer, Software, Travel",5.0,10,179.4,0.149296118
268,intubus,Video hosting and a shoppable video player for retailers,"E-Commerce, Video",3.2,9,62.1,0.268189845
269,unleash,"Unleash Inc is a Computer Software company located in 116 Woodland Ave, Summit, New Jersey, United States.","Accounting, Business Intelligence, Finance, Small and Medium Businesses, Software",10.0,6,30.8,0.706948895
270,wymsee,SyncOnSet is the leading entertainment technology company for digitizing physical production and managing creative content.,"Film, Film Production, Software, TV Production, Video",1.4,9,144.6,0.403125711
271,frrole,"Frrole is an AI-Powered Next-Gen Consumer Intelligence platform for marketers, analysts, product owners, recruiters, and sales folks.","Analytics, Artificial Intelligence, Big Data, Business Intelligence, Machine Learning, Natural Language Processing, Predictive Analytics, Recruiting, Skill Assessment, Social Media",1.5,10,533.5,0.192805341
272,instacart,Instacart delivers groceries and home essentials from a variety of local stores.,"Delivery, Delivery Service, E-Commerce, Grocery, Same Day Delivery",80.0,9,163.4,0.556117779
273,eventslice,We're an easy to use event services marketplace designed to help you find event spaces or event professionals all in one place.,"Event Management, Events, Professional Services",1.0,0,0.0,1.0
274,newsle,"Newsle is a web application that allows users to follow real news about their Facebook friends, LinkedIn contacts, and_public figures.","Mobile, News, Social Network, Software, Web Apps",1.0,10,1618.3,0.426926943
275,copypress,CopyPress provides content marketing products and software focused on the following: 1.,"Advertising, Content, Content Creators",5.3,5,165.7,0.400085736
276,easypost,EasyPost provides a simple postage API that allows developers to quickly and painlessly integrate shipping into any e-commerce application.,"Delivery, Logistics, Shipping",5.0,10,4941.4,0.538868845
277,careporthealth,Careport Health is an online booking engine for post-hospital care.,"Finance, Health Care",3.0,10,443.5,0.207605994
278,protagenictherapeutics,,,5.2,8,230.1,0.690774432
279,hublished,Hublished is a social network for brands to share webinars and eBooks in building a following and establishing their expertise.,"EBooks, Enterprise Software, Social Network",1.0,10,4845.8,0.8634822529999999
280,enchroma,EnChroma develops eyewear for color blind people to improve human color vision.,Eyewear,2.8,0,0.0,1.0
281,placemeter,Placemeter is an urban intelligence platform. We quantify modern cities worldwide. The answers you need are all around you.,"Analytics, Big Data, Finance, GovTech, Internet of Things, Local, Mobile",5.1,10,149.4,0.303658185
282,oncontracting,Onsite Contract Jobs at Top Companies & Staffing Agencies,"Consulting, Employment, Recruiting, Staffing Agency",3.0,10,299.8,0.734888636
283,reelgenie,"ReelGenie enables users to create videos from photos, video clips, music and other content.","Parenting, Photography, Video",14.3,9,100.2,0.184656635
284,crowdmed,CrowdMed provides prediction market technology using the collective intelligence of 'medical detectives' to produce diagnostic suggestions.,"Crowdsourcing, Health Care, Software",1.0,10,281.3,0.185569411
285,selligy,Selligy is a mobile service enabling sales teams to be more productive.,"CRM, Enterprise Software, Events, iOS, Meeting Software, Mobile, Professional Services, Task Management, Travel",5.5,10,199.7,0.35666745
286,lytics,Lytics helps companies personalize engagement with customers through the industry__ most advanced Customer Data Platform (CDP).,"Ad Retargeting, Analytics, Data Integration, Marketing Automation, Predictive Analytics, Software",4.4,10,276.8,0.351376905
287,ragbone,"rag & bone is a fashion retailer that sells clothing, shoes, and accessories.","E-Commerce, Fashion",56.1,10,27575.0,0.267083114
288,matchpoint,Connecting Great Music with Great Film,"Analytics, Film",4.8,9,45.6,0.162328793
289,cozy,Cozy is an online property management service for landlords and renters.,"Finance, Property Management, Real Estate",5.0,10,431.1,0.399518454
290,skillz,Skillz is a leading mobile eSports platform connecting the world__ 2.6 billion mobile gamers through competition.,"Developer Platform, eSports, Gaming, Mobile, Mobile Apps, Sports, Video Games",400.0,6,15.5,0.442247659
291,tindie,Tindie is an online marketplace enabling hardware developers to fund and sell their products.,"3D Printing, Electronics, Marketplace, Mechanical Engineering",6.9,9,144.8,0.188011279
292,trifacta,Trifacta enables anyone to efficiently explore and prepare data by utilizing machine learning to provide a breakthrough UX and architecture.,"Analytics, Big Data, Information Technology, Software",20.0,10,852.2,0.221688735
293,vividcortex,VividCortex is the best way to see what your production database systems are doing.,"Analytics, Application Performance Management, Enterprise Software, IT Management",6.4,10,724.1,0.392476373
294,yozio,"Yozio is a mobile growth engineering company providing an advanced analytics, organic growth marketing platform for mobile marketers.","Analytics, Marketing, Mobile",1.0,9,33.1,0.198072307
295,powerlinx,"B2B, Business Development, Small and Medium Businesses",,5.0,9,51268.5,0.907351201
296,floqq,Floqq is the biggest marketplace for online video courses in Latin America,"Education, Video",1.0,6,259.9,0.372785371
297,healthrecoverysolutions,Health Recovery Solutions develops a cloud-based warning system to help users reduce readmissions for hospitals and ACOs.,"Diabetes, Enterprise Software, Health Care, Information Technology",6.9,9,64.5,0.144262965
298,microtransponder,"MicroTransponder, a medical device company, develops and commercializes neurostimulation devices to treat neurological diseases.","Health Care, Medical, Medical Device",5.0,10,50594.5,0.572502276
299,sookasa,Sookasa provides encryption and compliance for sensitive files across cloud storage services and mobile devices.,"Cloud Security, Cyber Security, Enterprise Software",5.8,9,118643.0,0.997591166
300,reifyhealth,Building a more creative healthcare system.,"Clinical Trials, Health Care, Mobile",4.4,9,181.9,0.18514997
301,piqora,"Piqora helps commerce & marketing teams discover, amplify & merchandize shoppable user generated imagery (UGC) on e-commerce websites & Ads.","Analytics, E-Commerce, Social Media Marketing",2.0,9,30.8,0.128014842
302,blueapron,,,667.6,10,434.6,0.378652241
303,execonline,ExecOnline provides companies with executive training solutions.,"E-Commerce, EdTech, Education",4.9,9,1090.2,0.299621238
304,fuzeus,"FuzeUs is its own social network and SaaS that connects and empowers non-profits, corporations, and individuals.","Collaboration, Enterprise Software, Impact Investing",3.6,5,83.9,0.464473996
305,salido,"SALIDO is working with hospitality operators, developing a single platform for their restaurant operations.","Artificial Intelligence, Big Data, Cloud Computing, CRM, Hospitality, Logistics, Mobile Payments, Payments, Software, Supply Chain Management",1.5,10,137.9,0.175663545
306,solavei,Solavei is a U.S-based social commerce network offering contract-free mobile services and other support.,"E-Commerce Platforms, Mobile, Social Media",1.9,2,22.1,0.50451465
307,origamilogic,Origami Logic is a helps of world__ largest brands master the art and science of marketing performance.,"Analytics, Big Data, Enterprise Software",6.5,10,196.8,0.363575335
308,zelgor,Zelgor is a location-based gaming application that enables users to find friends and virtually capture them.,"Gaming, iOS, Location Based Services, Mobile",1.0,6,34.6,0.592903204
309,tapingo,Tapingo offers advance ordering for pickup and food delivery services for college campuses.,"Apps, Consumer, E-Commerce, Mobile, Trading Platform",5.0,9,1356.0,0.919538205
310,brightbytes,BrightBytes is a SaaS-based data analytics platform that measures and links the use of technology to learning outcomes.,"Analytics, Big Data, Education, SaaS",5.0,10,2017.4,0.266918996
311,joinem,Joinem's core proposition is WePower_ guaranteed savings of up to 25 percent off the lowest online price.,"E-Commerce, Group Buying, Retail",2.7,3,15.9,0.350025711
312,onemorepallet,OneMorePallet is a web-based shipping platform that connects shippers with carriers in the United States.,"Apps, E-Commerce, Logistics",1.0,10,415.2,0.541804493
313,wigwag,"WigWag empowers experience. We stand for openness, customization and simplicity in designing your living environment.","Internet of Things, Open Source, Smart Building",8.0,8,201.7,0.366121237
314,padlet,Padlet is an app that enables users to create an online bulletin board to display information on any topic.,"Knowledge Management, Web Browsers, Web Design",2.0,10,44.4,0.16815802300000002
315,entelo,"Entelo's recruiting platform enables top talent professionals to find, qualify, and engage with top talent.","Enterprise Software, Human Resources, Recruiting, SaaS, Software",5.0,9,198.3,0.316661619
316,webflow,"Webflow allows the user to design, build, and launch responsive websites visually, while writing clean, semantic code.","Content, Enterprise Software, Web Design",4.0,9,77.2,0.194760262
317,bettercloud,"BetterCloud is the first SaaS Operations Management platform, empowering IT to define, remediate, and enforce policies for SaaS applications","Apps, Cloud Security, Enterprise Software, SaaS, Software",12.4,9,124.3,0.213580929
318,nuzzel,"Nuzzel is a professional news discovery service used by many of the top influencers in media, technology, and finance","Digital Media, News, Social Media",4.0,9,370.2,0.585175242
319,wideo,Provides a simple and intuitive tool that enables people without previous knowledge or training to create quality online videos.,"Advertising, Digital Media, Education, Photography, Video",4.0,8,36.3,0.17998922399999998
320,materialwrld,Material World is a personal styling service delivering pre-owned designer items at 90% off retail,"Collaborative Consumption, E-Commerce, Fashion, Recycling, Retail",2.7,10,290.8,0.315245474
321,partender,Food & Bar Inventory: From 6 Hours to 15 Minutes,"Accounting, Finance, Hospitality, Mobile, Nightclubs, Nightlife, Restaurants, SaaS",3.3,9,102.3,0.162675855
322,charlieapp,Charlie is the Intelligence Platform for Sellers.,"Artificial Intelligence, Business Intelligence, SaaS, Sales, Sales Automation, Software",1.0,8,520340.5,0.380921283
323,yieldmo,Yieldmo is saving the world from bad mobile ads.,"Advertising, Advertising Platforms, Internet, Mobile, Predictive Analytics",2.0,10,728.1,0.29895774
324,workspot,"Workspot is an insanely simple, turnkey cloud service for securely delivering Windows 10 desktops from the cloud to any device. ","Cloud Computing, Software, Virtual Desktop",8.8,10,14125.7,0.4487615
325,ifunding,iFunding is a commercial real estate investment platform giving accredited investors access to investment opportunities online.,"Crowdfunding, Financial Services, FinTech, Real Estate, Real Estate Investment",2.0,9,80.4,0.191167917
326,lawkick,LawKick is an online marketplace that connects clients with legal service providers at affordable prices.,"B2B, Internet, Law Enforcement, Legal",3.8,9,57.7,0.163605453
327,trumaker,Trumaker is a new kind of men's apparel brand where every guy gets a client,"Direct Sales, E-Commerce, Fashion, Retail",4.4,9,269.2,0.270784715
328,bluenoseanalytics,Bluenose helps SaaS companies grow and retain their customers.,"Enterprise Software, Predictive Analytics, SaaS",4.0,8,40.2,0.155577832
329,teachboost,"TeachBoost is an evaluation and feedback platform designed to engage teachers and administrators in an ongoing, evolving dialogue that","Collaborative Consumption, Education, Online Forums",1.0,10,127.5,0.25240692
330,lever,"The modern, collaborative recruiting platform that powers a more human approach to hiring","Enterprise Software, Human Resources, Recruiting, SaaS, Software",5.5,9,189.8,0.344149074
331,applovin,AppLovin is a comprehensive platform where game developers of all sizes can connect with their ideal consumers and get discovered.,"Advertising, Mobile, Mobile Apps",234.2,10,736.5,0.474674856
332,guardanthealth,Guardant Health is committed to positively and significantly impacting patient health through technology breakthroughs in oncology.,"Biotechnology, Health Care, Health Diagnostics",86.8,10,2753.9,0.7181167340000001
333,bookboard,Subscription kid's ebooks for families,"Education, Mobile, Parenting",1.0,10,72.4,0.175711975
334,appthority,"Appthority is the global leader in enterprise mobile threat protection. We keep security teams informed, employees productive and enterpr","Mobile, Mobile Apps, Security",2.7,10,2401.8,0.434962773
335,userpod,"UserPod, a mobile application, enables its users to scan product IDs, serial numbers, and service tags.","Automotive, Cloud Computing, Enterprise Software, Information Technology, Mobile, SaaS, Software",6.4,10,163.5,0.16230246199999998
336,edsurge,"EdSurge helps educators find & use the right tools to support all learners. We do this through outstanding content, community and tools.","EdTech, Education, Email Marketing, Events, Market Research, Search Engine",2.2,9,9004.8,0.8717832659999999
337,teralytics,We change how the world moves. ,"Artificial Intelligence, Business Intelligence, Cyber Security, Data Visualization, Predictive Analytics, Transportation",1.0,10,5384.4,0.436880069
338,everypost,Everypost is a social media tool that enables publishers to post multimedia content across multiple social platforms.,"Internet, Mobile, Social Media",3.8,10,343.5,0.255053446
339,launchkey,Dynamic mobile authentication and realtime authorization platform. LaunchKey is a part of iovation.,"Cyber Security, Identity Management, Internet of Things, Mobile, Security",1.4,10,495.1,0.16654113199999998
340,nastygal,Fashion,"E-Commerce, Fashion, Retail",77.0,10,395.5,0.4133168820000001
341,recargo,Electric vehicle service provider,"Apps, Automotive, Mobile, Renewable Energy, Transportation",3.1,10,21651.9,0.986034016
342,cloze,Smarter Relationship Management. The no-work way to see everything about your contacts in one place.,"Mobile Apps, Social Media, Web Browsers",1.1,9,558.2,0.775882478
343,tagboard,"Tagboard is a software platform aggregating social media content from multiple networks for end-users, brands and marketers.","SaaS, Social Media, Software",5.5,10,253.5,0.421668553
344,leadid,"Analytics, Big Data, Compliance, Consumer, Enterprise Software, Marketing",,9.9,5,107.7,0.281293941
345,doublerobotics,"Double Robotics, the developer of an iPad-based tele-presence robot, is focused on building innovative products in the field of robotics.","Hardware, iOS, Robotics, Software",3.7,7,30.4,0.20498615
346,xocommunications,"XO Communications is a telecommunications company providing IP communications, networks, and IT infrastructure to businesses.","Telecommunications, VoIP, Web Hosting",1700.0,10,300.4,0.20056835
347,spothero,"SpotHero is the parking reservation platform, with 20 million+ cars parked and the largest network of connected parking facilities.","Consumer, Mobile Apps, Parking, Transportation",6.0,10,66.2,0.258819288
348,growmobile,"Grow Mobile provides a single, mobile ad buying platform for marketers to buy, track and optimize mobile app promotions.","Ad Network, App Marketing, Apps, Mobile",3.3,10,358.0,0.354701788
349,flightcar,FlightCar inspires and enables local owners and visitors to come together to list and rent each other__ unique cars at airports nationwide.,"Internet, Sharing Economy, Travel",2.4,10,396.5,0.528319581
350,universitynow,UniversityNow is engaged in developing learning technologies and building universities to back post-secondary education across the globe.,"Education, Higher Education, Tutoring",1.0,10,282.4,0.207021313
351,nightpro,"NightPro is an event and venue platform that helps users manage reservations, table availability, and client databases in real time.","Event Management, Hospitality, Nightlife",1.0,3,3.0,0.333333333
352,lookingglasscybersolutions,Lookingglass Cyber Solutions is a cyber-security software company helping organizations protect against targeted attacks.,"Cyber Security, Enterprise Software, Security",12.0,10,432.5,0.694193271
353,rollbar,Easy and powerful error monitoring and debugging for developers,"Analytics, Developer Tools, Internet, SaaS",6.0,10,58.8,0.34312092200000005
354,rallyware,Training that connects learning with performance data,"Corporate Training, Enterprise Software, Gamification, Human Resources, Project Management, SaaS, Social Media",4.0,10,1046.5,0.322325491
355,shiftlabs,Shift Labs provides medical devices for emerging markets in the healthcare sector.,"Emerging Markets, Health Care, Product Design",3.2,9,138.9,0.218143585
356,eshares,"Carta is building a global ownership management platform to help companies, investors, and employees manage their equity.","Enterprise Software, Finance, FinTech, Internet",17.0,10,315.8,0.322951331
357,noredink,NoRedInk is a web-based learning platform supporting students to_improve their grammar and writing skills.,"Consumer, E-Learning, Education",1.0,9,284.1,0.428946657
358,kamcord,Kamcord is a social media platform allowing its users to post and interact through video content.,"Gaming, Mobile, Social Media, Social Network, Video Streaming",1.0,10,66.3,0.242025712
359,medstartr,MedStartr is a crowdfunding platform designed for the healthcare industry.,"Automotive, Biotechnology, Crowdfunding, Finance, Health Care, Incubators, Venture Capital",4.6,10,113.1,0.180358063
360,bluepillar,Blue Pillar__ open IoT platform connects Distributed Energy Resources into an energy controls network 75% faster and 30% more affordably.,"Energy, Energy Management, Internet of Things",12.0,10,128.0,0.190855713
361,clever,"Big Data, Data Integration, EdTech, Education",,2.7,9,89.1,0.256137885
362,statwing,"Statwing provides web-based statistical analysis software for business users, data analysts, and market researchers.","Analytics, Big Data, Data Visualization",5.0,7,128.9,0.234100562
363,twitch,"Twitch is social video platform for gamers where more than 100 million gather every month to broadcast, watch and talk about video games.","Social Media, Video, Video Games, Video Streaming",30.0,8,9322.9,0.932697298
364,lifx,"LIFX is the creator of Wi Fi-enable, multi-colored LED lights controllable via a smart device.","Electronics, Hardware, Internet of Things, Lighting",2.4,9,5958.2,0.318512782
365,seedspark,Seed&Spark is an entertainment platform for conscious consumers actively increasing diversity and representation in entertainment.,"Crowdfunding, Film, Video Streaming",1.0,3,13.4,0.355201604
366,udacity,Udacity provides and promotes digital education services.,"E-Learning, EdTech, Education, Internet, Training",67.5,8,100.4,0.285896256
367,snapwire,Snapwire is a platform where talented mobile photographers shoot custom images for people around the world.,"Advertising, Crowdsourcing, E-Commerce, Image Recognition, Mobile, Photography",3.8,8,87.9,0.25256361
368,drawbridge,"Drawbridge connects, unifies, and supercharges customer data to create a complete view of the people you do business with.","Analytics, Artificial Intelligence, Big Data, Digital Marketing, Identity Management, Machine Learning, Mobile, Personalization, SaaS",20.0,8,393.0,0.4402169
369,conocophillips,"Energy, Oil and Gas",,38700.0,10,1271513.3,0.192947319
370,creandum,Creandum is a leading european early-stage venture capital firm investing in innovative and fast-growing technology companies.,"Finance, Financial Services, Venture Capital",4.0,10,191.6,0.180556766
371,mangohealth,Mobile health company on a mission to inspire and empower patients with chronic conditions to lead healthier lives.,"Health Care, Mobile, Wellness",1.0,10,149.1,0.468467411
372,strikingly,Strikingly is an online web platform enabling individuals to build mobile-optimized websites.,"Internet, Mobile, Web Design",4.0,9,60259.9,0.859883405
373,lantronix,"Hardware, Internet of Things, IT Infrastructure, Network Security, Software",,47.3,10,7637.5,0.471713273
374,ninjametrics,Ninja Metrics offers a social analytics engine that allows companies to measure the key influencers in their social game or mobile app.,"Analytics, Data Mining, Information Technology",2.0,9,314.1,0.31640266100000003
375,sureify,Sureify is an industry leading SaaS platform for Life and Annuity companies.,"B2B, Enterprise Software, FinTech, Insurance, Internet of Things, Life Insurance, SaaS, Software",1.0,9,105.2,0.266548237
376,convrrt,Convrrt is an online platform that enables users to create landing pages for marketing products and services.,"Advertising, Analytics, SEO",1.7,8,158.6,0.214306614
377,conceptdrop,ConceptDrop matches brands with an invite-only community of creative professionals.,"Enterprise Software, Marketing Automation, Marketplace",4.0,10,76.6,0.184059473
378,appetite,Appetite+ is a mobile solution that integrates social and personalized elements into app-discovery for meaningful discovery experiences.,"iOS, Mobile",1.2,1,7.6,0.76446281
379,upstart,Upstart is the first lending platform to leverage machine learning to price credit and automate the borrowing process.,"Credit, Finance, Financial Services, FinTech, Internet, Lending, Personal Finance",4.0,10,15615.1,0.985333475
380,floored,Floored develops software that turns 3D spatial data into clean interactive virtual worlds that can be explored through the web.,"3D Technology, Enterprise Software, Hardware, Real Estate, Software",2.0,10,78.3,0.334899175
381,paperkarma,PaperKarma is an app that stops postal junk mail! Snap a photo. Stop paper junk mail & catalogs. Save a tree!,"Apps, Email, Mobile",1.0,8,113.1,0.24747393
382,histowiz,HistoWiz automates histopathology for cancer researchers and is building the world__ largest cancer image database.,"Artificial Intelligence, Biotechnology, Database, Government, Health Care, Hospital, Life Science, Medical, Pharmaceutical, Veterinary",10.0,10,140.6,0.157170347
383,kitchensurfing,Kitchensurfing enables people to eat together and to eat purposefully by sending private chefs into their home kitchens.,"Food and Beverage, Hospitality, Marketplace",1.6,9,62.1,0.261375217
384,stackdriver,Stackdriver provides monitoring services for cloud-powered applications.,"Apps, Cloud Computing, Enterprise Software, Infrastructure",1.0,10,715.2,0.439840008
385,coinbase,Coinbase is a digital currency wallet service that allows traders to buy and sell bitcoin.,"Bitcoin, Blockchain, Cryptocurrency, E-Commerce, Ethereum, FinTech, Personal Finance, Virtual Currency",139.6,10,80.1,0.13621394
386,swipp,"Swipp, a platform with an analytics dashboard, integrates social media and commerce to convert social posts into leads and sales.","Analytics, Big Data, Social Media",2.4,7,138.9,0.203709492
387,promolta,"A self service advertising platform to promote videos in targeted blogs, websites, mobile apps, games and social networks.","Advertising, Advertising Platforms, Internet, Video Advertising",1.1,10,181.6,0.338681859
388,shopsy,Shopsy is a mobile application that enables Instagram users to purchase products they discover on Instagram.,"Analytics, E-Commerce, Ediscovery, Fashion, Mobile, Photo Sharing, Search Engine",1.0,10,707.2,0.568748033
389,stanfy,"Stanfy is a design and development studio, specializing in software solutions for mobile, wearable devices and connected electronics (IoT).","Apps, Mobile, Outsourcing, Wearables",1.0,9,118.1,0.164010178
390,pigeonly,"Pigeonly is focus on markets that are overlooked and underserved, particularly, in minority communities.","Consumer Goods, Internet, VoIP",2.0,10,114.6,0.16954792300000002
391,contigofinancial,Contigo Financial facilitates a web-based platform that provides employees with financial products such as short-term loans.,"Credit, Finance",1.0,10,4791.1,0.214444499
392,upworthy,Upworthy is on a mission to change what the world pays attention to.,"Digital Media, Publishing, Social Media",4.0,10,916.3,0.412174708
393,highfive,Highfive simplifies business collaboration with a conferencing platform that builds connected cultures.,"Collaboration, Enterprise Software, Meeting Software, SaaS, Video Conferencing",7.0,10,80994.7,0.965938922
394,connectifier,"Connectifier helps recruiters discover, qualify, and connect with exceptional job candidates at roughly twice the rate of other solutions.","Career Planning, Enterprise Software, Machine Learning, Recruiting, SaaS, Search Engine",2.9,9,56.3,0.215084125
395,fundersclub,FundersClub is an online venture capital firm.,"Finance, Financial Services, Funding Platform",3.9,10,117.2,0.5130461620000001
