133,judicata,Judicata is a legal technology company providing research and analytics tools to turn unstructured case law into structured data.,"Analytics, Legal, SaaS",2.5,10,90.4,0.191185684
134,paybook,Connecting people with their financial world!,"Finance, FinTech, SaaS, Software",1.0,8,592.4,0.8027294640000001
135,filtereasy,FilterEasy is America's air filter delivery service.,"B2B, B2C, Delivery Service, E-Commerce, Subscription Service",5.0,9,64.6,0.220930901
136,avinetworks,"Avi Networks drives automation and intelligence across multi-cloud environments with intent-based application services, including LB and WAF","Analytics, Cloud Data Services, Cloud Infrastructure",2.0,10,427.5,0.34829446299999994
137,goldenreviews,"Golden Reviews provides an inside look at senior care via the shared experiences of caretakers, seniors, and their families.","Health Care, Non Profit",1.0,0,0.0,1.0
138,datarobot,DataRobot provides a predictive analytics platform to rapidly build and deploy predictive models the cloud or an enterprise.,"Artificial Intelligence, Enterprise Software, Information Technology, Machine Learning, Predictive Analytics, SaaS",37.0,9,790.9,0.4447468670000001
139,survata,Survata is a marketing research company that sells brand intelligence to the world__ largest brands.,"Advertising, Analytics, Consumer Research, Market Research, Product Research, Test and Measurement",8.4,8,637.7,0.377558656
140,bulubox,"Your Brand, Your Subscription Box.","E-Commerce, Ediscovery, Fitness, Health Care, Lifestyle, Nutrition, Personal Health, Subscription Service",3.2,9,415.2,0.310798635
141,muut,"Muut is a discussion platform providing a clean user interface, persistent content and deep integration to websites.","Blogging Platforms, Content, Real Time, Social Media, Software",2.6,10,313023.4,0.473839224
142,sipx,SIPX is a web-based service that manages copyright and delivers digital documents for the higher education marketplace.,"Education, Information Technology, Web Browsers",2.0,10,78.4,0.136154207
143,allcampus,All Campus collaborates with universities and helps them expand online enrollment programs.,"Education, Training, Universities",4.1,10,249.1,0.22979281
144,ondigo,ONDiGO is a Sales-automation platform powered by deep-data,"Android, CRM, Direct Sales, Lead Management, Mobile, Sales Automation",1.5,10,286.6,0.217972193
145,artisanmobile,"Artisan Mobile is a mobile software provider that enables marketers to understand user behavior, create segments, and more.","Analytics, Android, Apps, CRM, iOS, Marketing Automation, Mobile, Personalization, Software",5.0,10,187.9,0.31965498600000003
146,apmetrix,Video Game and Mobile App Analytics,"Analytics, Apps, Mobile, Software",7.2,10,280.2,0.24765297100000006
147,qrpharma,"QR Pharma develops novel treatments for Alzheimer__ disease, Parkinson__ disease, and other neurodegenerative disorders.","Biotechnology, Developer Platform, Therapeutics",3.5,10,1757.5,0.935811746
148,fibroblast,Fibroblast offers a cloud-based practice management tool that facilitates online patient self-scheduling and instant cross-referrals.,"Enterprise Software, Health Care, Information Technology, Medical",4.0,9,82.9,0.136349548
149,mobilewalla,"Mobilewalla is the world__ most trusted source for independent mobile audience data at scale.
","Advertising, Analytics, Artificial Intelligence, Big Data, Digital Marketing, DSP, Machine Learning, Mobile",10.0,9,242.7,0.225448697
150,advercar,adverCar offers a technology platform that parters ads with drivers to weave messages into consumers' online lives.,"Advertising, Automotive",11.0,6,2708.0,0.994102694
151,linkwellhealth,"Linkwell Health, a consumer engagement company, promotes_health by combining health plans, better-for-you brands, drugstores and retailers.","Fitness, Health Care, Wealth Management, Wellness",4.7,9,1221.8,0.812938672
152,mdinsider,Machine Learning Enabled Physician Performance Transparency,"Big Data, Health Care, Hospital, Machine Learning, Medical",2.0,10,695.7,0.599256436
153,kite,Kite is an app that offers student progress tracking and analytics to educators.,"Analytics, Education, Mobile Apps",1.0,9,325.1,0.266255155
154,patientco,"Patientco technology redefines the patient financial experience, improving patient satisfaction & financial outcomes for health systems.","FinTech, Health Care, Medical, Payments, SaaS",12.0,9,166.1,0.178218586
155,faraday,"Faraday optimizes every stage of your B2C revenue journey, from acquisition to retention using artificial intelligence and machine learning.","Artificial Intelligence, Big Data, Machine Learning, Marketing Automation, SaaS, Software",30.2,10,1235786.0,0.1631953
156,ubiome,uBiome is a citizen science startup that sequences the human microbiome.,"Health Care, Machine Learning, Quantified Self",32.0,10,112.3,0.219480323
157,opencare,Opencare is building the largest network of dentists that deliver enjoyable care.,"Dental, Health Care, Marketplace, Small and Medium Businesses, Software",6.1,10,1089.9,0.7199831990000001
158,hanesbrands,"Consumer Goods, E-Commerce, Retail",,6800.0,10,50884.6,0.221005709
159,discoverybaygames,Discovery Bay Games is a creator of family-oriented and educational multi-player games.,"Consumer, Gaming",4.5,1,9.8,0.568683065
160,hackreactor,The CS Degree for the 21st Century.,"Education, Software",4.5,10,61.5,0.349329103
161,ncryptedcloud,"e-Share, formerly nCryptedCloud, enables the modern enterprise to securely collaborate with external recipients without giving away the data","Collaboration, Enterprise Software, Privacy, Security",5.3,9,153.3,0.186467406
162,800razors,800razors is a razor company manufacturing and commercializing American-made razors.,"E-Commerce, Manufacturing, Product Design",7.1,9,6816.7,0.910262987
163,socialtoaster,"SocialToaster is a fan engagement and loyalty rewards platform that helps clients identify, recruit, engage, and monetize social audience.","B2B, Content Syndication, Social Media Marketing, Software",2.7,10,199.3,0.32340613100000004
164,trafficland,"TrafficLand broadcasts on-demand live videos on internet and television, granting access through various IT-enabled devices.","Advertising, Broadcasting, Internet, News, Online Portals, Software, Telecommunications, Video, Video on Demand",50.0,1,10.4,0.714924784
165,yurbuds,"Yurbuds develops a type of sport earphones that are custom fit for athletes, runners and_music lovers.","Audio, Hardware, Music, Software, Sports",2.0,9,55.1,0.200944661
166,sumologic,"Sumo Logic, a log management and analytics service, transforms big data into sources of operations, security and compliance intelligence.","Analytics, Big Data, Enterprise Software, Information Technology, SaaS, Security",72.4,10,71.3,0.129274208
167,battlefy,Battlefy is the simplest way to find and manage esports competitions.,"eSports, Gaming, Video Games",5.0,8,2378.5,0.935380885
168,slowventures,"Slow Ventures invests in companies central to the technology industry and those on the edges of science, society, and culture.","Angel Investment, Finance, Venture Capital",56.9,10,96.0,0.125186632
169,wrightspeed,"Wrightspeed is evolving vehicle propulsion, using high-power electric drive with micro-turbine generators.","Automotive, Electronics, Manufacturing",15.0,10,89.8,0.11093943
170,atreca,"Atreca develops a technology to identify the set of antibodies produced during an immune response, without prior knowledge of an antigen.","Biotechnology, Health Care, Therapeutics",3.0,10,300.1,0.216993425
171,zetroz,ZetrOZ is an innovative ultrasound technology company focused on developing innovative ultrasound products and applications.,"Biotechnology, Hospital, Information Technology, Medical Device",10.0,6,46.0,0.208856333
172,odysseythera,Odyssey Thera develops cellular pharmacology strategy for the identification of medicines for cancer and other human diseases.,"Biopharma, Biotechnology, Pharmaceutical",13.4,10,53995.0,0.409520268
173,epantry,"Home and personal care products that make it easy to create a healthy, beautiful home.","Consumer Goods, E-Commerce, Internet, Retail, Sustainability",1.0,10,942412.7,0.379810678
174,matchist,Matchist is a product design company that helps businesses with APIs develop certification programs.,"Developer APIs, Market Research, Product Design, Social Entrepreneurship, Web Development",1.0,9,435.6,0.6829020440000001
175,ondore,"Proprietary technology for real-time social media monitoring & big data analysis, focused on online reputation management.","Big Data, Reputation",1.0,8,46.2,0.16878431800000002
176,mytime,"MyTime powers online scheduling, automated marketing and point of sale for mid-market and enterprise service retailers.","Apps, E-Commerce, Local Business, Marketing Automation, Mobile, Point of Sale, Scheduling",6.1,10,442.1,0.33889247
177,ecinity,"Ecinity is an automated online marketing service for local businesses. Ecinity changed its name to Bridg in August, 2013.","Internet, Marketing, Marketing Automation",43.5,8,63.9,0.350055471
178,massdrop,Community-driven commerce,"Communities, E-Commerce, Shopping",16.8,10,512.0,0.255399933
179,ahalogy,"Ahalogy is the Passion to Purchase Platform, combining category trend data, influencer network & social optimization software to drive ROI.","Brand Marketing, Content, Content Creators, Content Marketing, Information Technology, SaaS, Social Media, Software",2.9,10,195.8,0.595498836
180,urx,URX drives mobile commerce through relevant product ads.,"App Marketing, Digital Media, E-Commerce, Mobile",1.1,9,134.5,0.296598997
181,ravellaw,"Ravel is a platform for legal search, analytics and visualization.","Analytics, Legal, Search Engine",1.4,9,9560.9,0.7851447970000001
182,ppgindustries,,,42.1,10,140371.9,0.337847868
183,kraven,Krave-n Inc. provides an iPad-based point-of-purchase platform (POPP) for restaurants.,"Information Technology, Mobile, Restaurants",1.4,9,191.6,0.138531256
184,parlevelsystems,ParLevel develops hardware and software that provides intelligent solutions to the vending machine industry.,"B2B, Enterprise Software, Finance, Hardware, SaaS, Software",2.0,5,29.5,0.329709853
185,bounceimaging,Throwable omnidirectional/360 cameras for first responders,"Consumer Electronics, Hardware, Law Enforcement, Robotics, Sensor, Video",3.4,10,70672.5,0.967336591
186,zerochroma,Uber functional cases for Apple hardware,"Consumer Electronics, Fitness, iOS, Small and Medium Businesses",1.0,10,112361.1,0.46409556
187,tanium,Tanium is a security and systems management solution that allows real-time data collection at enterprise scale.,"Enterprise Software, Information Technology, Security",200.0,10,1966.9,0.231515162
188,devicefidelity,DeviceFidelity develops plug-and-play technologies that enable organizations to deploy their services and applications on mobile phones.,"Mobile, Payments, Wireless",2.4,10,8055.0,0.33442171800000003
189,beamtechnologies,A smarter dental benefits company that offers employers a proprietary underwriting method informed by oral hygiene routines.,"Dental, Insurance, Internet of Things",3.0,9,302209.3,0.448927688
190,powwow,PowWow Mobile is redefining the mobile enterprise.,"Enterprise Software, Information Technology, Software",3.0,10,127.6,0.487770364
191,healthpocket,HealthPocket is a technology company that compares and ranks health plans for its users.,"Consumer, Health Care, Non Profit",1.4,10,320915.1,0.19320872100000006
192,vadio,Vadio is a dynamic audio / video player for audio streaming platforms,"Internet Radio, Mobile, Video, Video Streaming",1.0,9,229.9,0.24290285600000006
193,uberall,Uberall provides a location marketing cloud that offers a solution to localize all aspects of online marketing __o increase local sales.,"Consumer Reviews, Enterprise Software, Local, Reputation, Search Engine, Social Media Management, Software",16.6,10,255.2,0.700265205
194,shopularapp,Shopular is changing the way people use their mobile phones to shop. The innovative mobile app notifies users of personalized deals.,"E-Commerce, Mobile, Shopping",2.0,10,21710.6,0.962682754
195,tylrmobile,Tylr mobile offers role-specific mobile work apps that connect mobile tools with business data and processes to increase productivity.,"Information Technology, Mobile, Mobile Apps",1.0,10,41478.3,0.273572009
196,cumulogic,CumuLogic is a software provider enabling enterprises and cloud-computing providers to deliver AWS-like cloud services.,"Cloud Computing, Cloud Data Services, IaaS, Software, Virtualization",1.0,9,5869.5,0.509178044
197,lucidenergy,Creating a new way for industries particularly those that use large amounts of water and electricity.,"Energy, Renewable Energy, Water",3.8,8,126.3,0.198548868
198,keychainlogistics,Keychain Logistics utilizes mobile technology to bridge the logistical gap between shippers and carriers of freight.,"Digital Media, Fleet Management, Software, Supply Chain Management, Transportation",1.0,9,348.7,0.444280444
199,suredone,SureDone provides a dashboard that enables e-businesses to upload their products once and sell them on multiple channels.,"E-Commerce, Marketing, Marketplace",1.0,10,942.7,0.638781933
200,3drobotics,"3DR makes advanced drone technology easily accessible to the construction, mining, and surveying industries for use in data analysis.","Drones, Robotics, SaaS",93.3,10,287.9,0.344192854
201,playteau,Playteau creates a mutliplatform game portfolio for social networks.,"Gaming, Social, Social Network",1.0,2,2.0,0.5
202,authorea,Google Docs meets Github for scientific research.,"Collaboration, Life Science, Publishing, Software",4.0,9,44.2,0.116950922
203,springbot,"Springbot delivers data-driven marketing recommendations, marketing automation, and analytics in one dynamic platform for SMB merchants.","Analytics, Artificial Intelligence, Big Data, E-Commerce, Email Marketing, Marketing Automation, Marketplace, SaaS, Social Media Marketing",2.0,9,597.8,0.683779803
204,shoppad,ShopPad is an application used to convert a desktop e-commerce site into an interface optimized for every version of the iPad.,"E-Commerce, iOS, Mobile, SaaS",5.2,8,67.9,0.27628996100000003
205,thehackettgroup,,,690.1,10,99768.8,0.326092119
206,sonardesign,"The Sonar platform enables anyone with a modern browser to create, share, promote, monetize, and analyze interactive experiences.","EdTech, Education, Training",4.2,10,158.5,0.351406025
207,cielo24,"cielo24 is an online platform that creates searchable metadata, including indexes, transcripts, and captions.","Enterprise Software, Search Engine",5.0,10,158.2,0.221856665
208,noxilizer,"Noxilizer provides room temperature NO2-based sterilization technology for the medical device, pharmaceutical and hospital industries.","Hospitality, Medical Device, Pharmaceutical",5.0,10,24889.0,0.349470826
209,nuorder,NuORDER is a cloud & mobile B2B eCommerce platform empowering brands and retailers to streamline their business operations.,"B2B, E-Commerce, Fashion, Internet, SaaS, Wholesale",9.6,9,77.6,0.225415825
210,appmyday,AppMyDay operates an online social platform for event and photo-sharing.,"Events, Mobile, Mobile Apps, Private Social Networking",1.0,9,41.1,0.341408114
211,datagravity,DataGravity is a software company engaged in the IT industry and is focused on providing data security and remediation services.,"Enterprise Software, Information Services, Information Technology, Network Security",13.8,10,2409.1,0.355889239
212,tracelink,TraceLink is a SaaS platform for tracking and tracing pharmaceuticals.,"Compliance, Life Science, Pharmaceutical, SaaS, Supply Chain Management",18.0,9,4133.9,0.93652263
213,glossi,Glossi is a publishing platform that enables users to create and share their own digital magazines across multiple devices.,"Advertising, Digital Media, News, Publishing",1.0,9,681.8,0.237974239
214,factorio,Factor.io offers a service for developers to define and integrate their continuous deployment and integration workflow.,"Computer, Internet, Software",1.0,1,48.2,0.960175821
215,realtymogul,"We're an online marketplace for real estate investing, connecting borrowers and sponsors to individual and institutional investors.","Finance, FinTech, Marketplace, Real Estate, Real Estate Investment",3.0,10,62.9,0.15016391099999998
216,luxresearch,Emerging Tech Research & Advisory Firm,"Big Data, Biotechnology, Consulting, Energy, Innovation Management, Internet of Things, Market Research, Professional Services, Wearables",21.9,9,7198.9,0.972767903
217,sprinklr,Sprinklr provides social media management platform that enables enterprise brands to connect with customers across every touch point.,"Advertising, Analytics, Blogging Platforms, Enterprise Software, Social CRM, Social Media, Social Media Management, Social Media Marketing",150.0,10,426.7,0.167350944
218,kidaptive,Kidaptive is a media and technology company creating entertaining and adaptive content that helps children learn.,"Big Data, EdTech, Education, Machine Learning, Personalization",4.0,10,137.7,0.146957828
219,rootsrated,"RootsRated is a media platform that connects users with the best outdoor experiences, hand- picked by local experts.","Apps, Big Data, Mobile, SaaS, Social Media",19.4,7,132.0,0.397153352
220,rentlytics,Rentlytics is building the platform to transform the world__ real estate data into accessible information.,"Analytics, B2B, Property Management, Real Estate, SaaS",5.7,10,425.5,0.40512957
221,citymaps,"Citymaps is a social mapping community, building the world__ largest catalog of map collections, for every interest, all around the world.","Local, Search Engine, Travel",1.0,9,1041.8,0.7163723009999999
222,handsontest,Hands On Test is a cloud-based application that helps companies maximize their time spent finding exceptional talent.,"Human Resources, Information Technology, Software",1.0,3,12.5,0.463936
223,gripeo,Submit your customer service issue with GripeO.,"Advertising, Customer Service, Lead Generation, Mobile, SaaS, Social Media Marketing",4.0,10,321.1,0.4377263770000001
224,birst,Birst is a global leader in cloud business intelligence and analytics for the enterprise.,"Analytics, Business Intelligence, Embedded Software, Enterprise Software, Web Development",13.0,10,1619.9,0.56120079
225,apozy,Perceptual AI to stop phishing and social engineering for Chrome and GSuite.,"Cloud Security, Cyber Security, Enterprise Software, Information Technology, SaaS, Security",1.0,10,208.0,0.256980399
226,fundacity,Fundacity connects startups and investors by offering an online investment platform and tools to help both sides with fundraising.,"Cloud Infrastructure, Finance, FinTech, Impact Investing",1.0,10,472.3,0.721556217
227,redapt,Redapt is a systems integrator that delivers data center infrastructure and cloud solutions tailored to meet business goals.,"Cloud Computing, Data Center, Web Hosting",34.5,9,25329.0,0.7261945670000001
228,perfectaudience,Perfect Audience is a retargeting platform that lets marketers bring back lost web visitors through Facebook ads and banner ads in the web.,"Ad Retargeting, Advertising, Marketing, Service Industry",9.3,9,410.2,0.547812117
229,avocadosoftware,Avocado is an app that enables couples to stay connected by messaging and sharing photos with each other.,"Android, iOS, Mobile, Software",1.2,10,1922.7,0.326089214
230,realync,Realync is a real time touring platform enabling live and recorded video tours for the multifamily and real estate industries.,"Mobile, Real Estate, Real Time, Video",4.3,9,51.8,0.128821872
231,boatbound,Boatbound is_a fully insured __ier-to-pier_ marketplace for boat rentals in the U.S.,"Boating, Collaborative Consumption, Marketplace",2.7,8,78.9,0.342457524
232,enerdigmventures,,,5.5,9,212.9,0.202382452
233,smartlunches,Smart Lunches is an online ordering and delivery platform that enables parents to order school lunch for their children.,"Delivery Service, E-Commerce, Education, Food and Beverage, Internet, Online Portals, Software",5.5,10,2047.6,0.426295255
234,fittr,"Fittr creates customized workout plans based on fitness goal, equipment available, time available, and exercise style preferences.","Fitness, Health Care",4.7,10,95.4,0.286649174
235,wildflowerhealth,Focus on our clients needs: we will integrate our services into existing sustainability programmes.,"Health Care, Mobile",4.0,9,55.2,0.15519979999999994
236,proletariat,Proletariat is a Boston-based startup built by game-industry veterans,"Computer, Gaming, Video Games",3.9,8,11361.9,0.4517179120000001
237,gigturn,"Gigturn is an e-commerce platform that helps DJs and musicians connect and interact with venues, promoters, and influencers.","E-Commerce, Marketplace, Music",1.0,1,1.0,0.5
238,goodco,"Good&Co is a platform that connects people, companies, and workplaces. We help job seekers, employers, and employees to find a great fit.","Analytics, Big Data, Human Resources, Internet, Psychology, Recruiting, Social Media",11.9,9,115.9,0.392828455
239,pivotdesk,PivotDesk is an office-sharing marketplace connecting companies with extra office space with startups and small businesses.,"Coworking, Internet, Real Estate",6.0,10,1382.1,0.88556607
240,rebelmouse,RebelMouse is the first publishing platform fully wired for social. Enabling brands & publishers to create vibrant content experiences,"Advertising, Content, Digital Media, Publishing, Social Media",3.1,8,5011.3,0.918890558
241,transloc,TransLoc offers real-time passenger information services.,"Public Transportation, Transportation",2.5,9,87.3,0.213130586
242,truesocialmetrics,Metrics that Matter Social media analytics tool for all social networks in one dashboard Competitive analysis and Content Segmentation.,"Social Media, Social Media Marketing",1.0,10,355.3,0.239048214
243,getmaid,"Get Maid is an on-demand, premium maid service that enables users to book a maid_instantly via iPhone or Android devices._","E-Commerce, iOS, Mobile",1.0,7,88.3,0.287944296
244,petcube,"Petcube is a worldwide leader in pet cameras & software, connecting pets to the internet and giving them a voice.","Consumer Electronics, Hardware, Internet of Things, Mobile, Robotics, Software",1.2,10,336.0,0.4291560370000001
245,reschedge,Reschedge is cloud-based software trusted by the world's leading recruiting teams to schedule their interviews.,"Human Resources, Recruiting, Software",2.0,9,25.0,0.201312
246,cloudamize,Cloudamize provides optimization and capacity planning tools for companies to manage their cloud-based infrastructure.,"Analytics, Cloud Computing, Web Hosting",1.0,10,75.5,0.125108548
247,galls,The Authority in Public Safety Equipment and Apparel.,"Law Enforcement, Retail, Shopping",214.9,9,53.3,0.158172263
248,massroots,"RoboCent provides call and text notification systems for businesses, schools, political campaigns, and non-profits.","Advertising, Business Intelligence, Marketing, Mobile, Non Profit, Telecommunications",1.0,8,97.8,0.357438284
249,mojio,"MOJIO is an open platform that enables users to connect their cars with other people, places, and things via smartphone apps.","Android, Apps, FinTech, Internet, iOS, Mobile, Robotics, Software, Wireless",6.0,8,131090.3,0.997100452
250,spikes,"A cyber security company with innovative, patented isolation technology to prevent browser-borne malware attacks.","Cyber Security, Network Security, Security",15.0,10,1010.2,0.660616767
251,imperative,The first HR talent platform leveraging AI and big data to drive meaningful work,"Artificial Intelligence, Big Data, Career Planning, Employment, Human Resources, Recruiting",6.4,1,3.0,0.565414215
252,threatstack,Threat Stack is a cloud infrastructure security company,"Cloud Security, SaaS, Security",1.5,10,1358.5,0.34349885
253,openidfoundation,The OpenID Foundation is a non-profit organization that manages the efforts to increase adoption of the OpenID standard across the web.,"Identity Management, Public Relations, Security",2.8,9,70.9,0.15102818699999998
254,telylabs,"Tely Labs offers telyHD, a video calling system that delivers HD Skype video-calling to the conference room on a HD television.","Internet, Video Conferencing",1.2,9,55245.7,0.848960029
255,cleanify,Cleanify connects you to the best cleaning services in your neighborhood.,"Collaborative Consumption, Home Services, Logistics, Mobile",1.0,2,349.9,0.972384222
256,heartflow,HeartFlow develops software for cardiovascular applications.,"Biotechnology, Emergency Medicine, Health Care, Health Diagnostics, Medical",7.6,8,136.1,0.344105044
257,completeset,The treasure map for collectors.,"Collectibles, E-Commerce, Marketplace",1.0,10,797287.3,0.501318943
258,topfloor,TopFloor is an online retailer of lifestyle products and gift items.,"E-Commerce, Fashion, Shopping, Social Media, Video",5.6,10,49.6,0.141299753
259,splicemachine,"Splice Machine is a data platform that offers offline, and batch analysis, and powers intelligent applications for operational workflows.","Analytics, Big Data, Information Technology",4.3,10,635.6,0.383508534
260,pymetrics,Pymetrics develops neuroscience-based assessment and prediction technology for staffing services.,"Artificial Intelligence, Intelligent Systems, Neuroscience, Recruiting, Staffing Agency",1.4,8,40.8,0.171412438
261,loopcommerce,Loop Commerce provides an enterprise-grade SaaS solution that fully integrates with retailers_ online stores to make every product giftable.,"E-Commerce, Enterprise Software, FinTech, SaaS",1.0,9,235355.7,0.979344895
262,smartthings,"SmartThings, a smartphone app, allows its users to monitor and control their domestic affairs even when they are out of their home.","Automotive, Enterprise Software, Hardware, Internet, Internet of Things, Mobile, Open Source, Small and Medium Businesses, Smart Home",6.5,8,202.3,0.34123228
